{
  "schema_version": "1.0",
  "phase": 9,
  "skill": "novel-export",
  "project_slug": "demo-novel",
  "status": "complete",
  "started_at": "2026-06-16T16:48:27+00:00",
  "artifacts": {
    "epub": [
      "G:\\CURSOR\\cursor-novel-writer\\examples\\demo-novel\\dist\\demo-novel.epub",
      "G:\\CURSOR\\cursor-novel-writer\\examples\\demo-novel\\dist\\test-skill-wrapper.epub",
      "G:\\CURSOR\\cursor-novel-writer\\examples\\demo-novel\\dist\\雾港来信.epub"
    ]
  },
  "subtasks": [
    {
      "id": "P9-S0",
      "title": "pipeline gate phase 9",
      "executor": "cli",
      "command": "novel pipeline gate --phase 9",
      "status": "done",
      "output_paths": []
    },
    {
      "id": "P9-S1",
      "title": "Quill export audit",
      "executor": "agent",
      "reference": "quill-export-audit.md",
      "status": "done",
      "output_paths": []
    },
    {
      "id": "P9-S2",
      "title": "create_epub",
      "executor": "cli",
      "command": "novel export",
      "status": "done",
      "output_paths": [
        "G:\\CURSOR\\cursor-novel-writer\\examples\\demo-novel\\dist\\demo-novel.epub"
      ]
    }
  ],
  "completed_at": "2026-06-16T16:48:27+00:00"
}
