{
  "schema_version": "1.0",
  "phase": 7,
  "skill": "novel-review",
  "project_slug": "demo-novel",
  "status": "complete",
  "started_at": "2026-06-16T16:48:27+00:00",
  "artifacts": {
    "review": "G:\\CURSOR\\cursor-novel-writer\\examples\\demo-novel\\reviews\\ch01-review.md",
    "deai_scan_json": "G:\\CURSOR\\cursor-novel-writer\\examples\\demo-novel\\reviews\\ch01-deai-scan.json"
  },
  "subtasks": [
    {
      "id": "P7-S0",
      "title": "deai audit dispatch",
      "executor": "cli",
      "reference": "deai-audit-dispatch.md",
      "status": "done",
      "output_paths": []
    },
    {
      "id": "P7-S1",
      "title": "novel audit deai",
      "executor": "cli",
      "command": "novel audit deai --json",
      "status": "done",
      "output_paths": [
        "G:\\CURSOR\\cursor-novel-writer\\examples\\demo-novel\\reviews\\ch01-deai-scan.json"
      ]
    },
    {
      "id": "P7-S2",
      "title": "deai-checklist + Sable",
      "executor": "agent",
      "reference": "deai-checklist.md",
      "status": "done",
      "output_paths": []
    },
    {
      "id": "P7-S3",
      "title": "review De-AI 节",
      "executor": "agent",
      "status": "done",
      "output_paths": [
        "G:\\CURSOR\\cursor-novel-writer\\examples\\demo-novel\\reviews\\ch01-review.md"
      ]
    }
  ],
  "completed_at": "2026-06-16T16:48:27+00:00"
}
