{
  "schema_version": "1.0",
  "phase": 3,
  "skill": "plot-structure",
  "project_slug": "demo-novel",
  "status": "complete",
  "started_at": "2026-06-16T16:48:25+00:00",
  "artifacts": {
    "arcs": [
      "G:\\CURSOR\\cursor-novel-writer\\examples\\demo-novel\\plot\\arcs\\arc-main-letter.md"
    ],
    "foreshadowing": "G:\\CURSOR\\cursor-novel-writer\\examples\\demo-novel\\plot\\foreshadowing.md"
  },
  "subtasks": [
    {
      "id": "P3-S1",
      "title": "plot arcs ≥1",
      "executor": "agent",
      "reference": "plot-structure/node-dispatch.md",
      "status": "done",
      "output_paths": [
        "G:\\CURSOR\\cursor-novel-writer\\examples\\demo-novel\\plot\\arcs\\arc-main-letter.md"
      ]
    },
    {
      "id": "P3-S2",
      "title": "foreshadowing.md",
      "executor": "agent",
      "status": "done",
      "output_paths": [
        "G:\\CURSOR\\cursor-novel-writer\\examples\\demo-novel\\plot\\foreshadowing.md"
      ]
    },
    {
      "id": "P3-S3",
      "title": "pipeline gate phase 4",
      "executor": "cli",
      "command": "novel pipeline gate --phase 4",
      "status": "done",
      "output_paths": []
    }
  ],
  "completed_at": "2026-06-16T16:48:25+00:00"
}
