{
  "schema_version": "1.0",
  "phase": 8,
  "skill": "novel-review",
  "project_slug": "demo-novel",
  "status": "complete",
  "started_at": "2026-06-02T16:15:56+00:00",
  "artifacts": {
    "review": "G:\\CURSOR\\cursor-novel-writer\\examples\\demo-novel\\reviews\\ch01-review.md"
  },
  "subtasks": [
    {
      "id": "P8-S1",
      "title": "re-review round",
      "executor": "agent",
      "reference": "review-repair-spec.md",
      "status": "done",
      "output_paths": [
        "G:\\CURSOR\\cursor-novel-writer\\examples\\demo-novel\\reviews\\ch01-review.md"
      ]
    }
  ],
  "completed_at": "2026-06-02T16:15:56+00:00"
}
