{
  "schema_version": "1.0",
  "phase": 2,
  "skill": "worldbuilding+character-management",
  "project_slug": "demo-novel",
  "status": "complete",
  "started_at": "2026-06-04T15:56:50+00:00",
  "artifacts": {
    "characters": [
      "G:\\CURSOR\\cursor-novel-writer\\examples\\demo-novel\\characters\\chen-wei.md",
      "G:\\CURSOR\\cursor-novel-writer\\examples\\demo-novel\\characters\\gu-yuan.md",
      "G:\\CURSOR\\cursor-novel-writer\\examples\\demo-novel\\characters\\lin-mo.md"
    ],
    "worldbuilding_locations": "G:\\CURSOR\\cursor-novel-writer\\examples\\demo-novel\\worldbuilding\\locations",
    "worldbuilding_systems": "G:\\CURSOR\\cursor-novel-writer\\examples\\demo-novel\\worldbuilding\\systems"
  },
  "subtasks": [
    {
      "id": "P2a-S1",
      "title": "地点/系统",
      "executor": "agent",
      "reference": "worldbuilding/node-dispatch.md",
      "status": "done",
      "output_paths": []
    },
    {
      "id": "P2b-S1",
      "title": "人物卡 ≥2",
      "executor": "agent",
      "reference": "character-management/node-dispatch.md",
      "status": "done",
      "output_paths": [
        "G:\\CURSOR\\cursor-novel-writer\\examples\\demo-novel\\characters\\chen-wei.md",
        "G:\\CURSOR\\cursor-novel-writer\\examples\\demo-novel\\characters\\gu-yuan.md",
        "G:\\CURSOR\\cursor-novel-writer\\examples\\demo-novel\\characters\\lin-mo.md"
      ]
    },
    {
      "id": "P2b-S3",
      "title": "novel relations check",
      "executor": "cli",
      "command": "novel relations check",
      "status": "done",
      "output_paths": []
    },
    {
      "id": "P2-S4",
      "title": "pipeline gate phase 3",
      "executor": "cli",
      "command": "novel pipeline gate --phase 3",
      "status": "done",
      "output_paths": []
    }
  ],
  "completed_at": "2026-06-04T15:56:50+00:00"
}
