{
  "schema_version": "1.0",
  "phase": 1,
  "skill": "story-init",
  "project_slug": "demo-novel",
  "status": "complete",
  "started_at": "2026-06-03T14:55:17+00:00",
  "completed_at": "2026-06-03T14:55:17+00:00",
  "artifacts": {
    "story_md": "G:\\CURSOR\\cursor-novel-writer\\examples\\demo-novel\\story.md",
    "project_json": "G:\\CURSOR\\cursor-novel-writer\\examples\\demo-novel\\canon\\project.json"
  },
  "subtasks": [
    {
      "id": "P1-S0",
      "title": "确认 active / slug",
      "executor": "cli",
      "command": "novel list",
      "status": "done",
      "output_paths": []
    },
    {
      "id": "P1-S1",
      "title": "story.md 与 premise",
      "executor": "agent",
      "reference": "story-template.md",
      "status": "done",
      "output_paths": [
        "G:\\CURSOR\\cursor-novel-writer\\examples\\demo-novel\\story.md"
      ]
    },
    {
      "id": "P1-S2",
      "title": "novel init 脚手架",
      "executor": "cli",
      "command": "novel init",
      "status": "done",
      "output_paths": [
        "G:\\CURSOR\\cursor-novel-writer\\examples\\demo-novel"
      ]
    },
    {
      "id": "P1-S3",
      "title": "pipeline gate phase 2",
      "executor": "cli",
      "command": "novel pipeline gate --phase 2",
      "status": "done",
      "output_paths": []
    }
  ]
}
